{
  "event": "contractor.created",
  "message_id": "msg-contractor-erp-660e8400-e29b-41d4-a716-446655440001",
  "timestamp": "2026-03-21T12:00:00+03:00",
  "uuid": "660e8400-e29b-41d4-a716-446655440001",
  "partner_uuid": "550e8400-e29b-41d4-a716-446655440000",
  "name": "ООО «Рога и Копыта»",
  "legal_name": "Общество с ограниченной ответственностью «Рога и Копыта»",
  "tax_id": "7701234567",
  "registration_number": "770101001",
  "legal_address": "г. Москва, ул. Пушкина, д. 10",
  "actual_address": "г. Москва, ул. Лермонтова, д. 5",
  "phone": "+74951234567",
  "email": "info@roga-kopyta.ru",
  "country": "RU"
}
